# 2005 January 19
#
# The author disclaims copyright to this source code.  In place of
# a legal notice, here is a blessing:
#
#    May you do good and not evil.
#    May you find forgiveness for yourself and forgive others.
#    May you share freely, never taking more than you give.
#
#*************************************************************************
# This file implements regression tests for SQLite library.  The
# focus of this script is testing correlated subqueries
#
# $Id: subquery.test,v 1.7 2005/02/12 08:59:59 danielk1977 Exp $
#

set testdir [file dirname $argv0]
source $testdir/tester.tcl

ifcapable !subquery {
  finish_test
  return
}

do_test subquery-1.1 {
  execsql {
    BEGIN;
    CREATE TABLE t1(a,b);
    INSERT INTO t1 VALUES(1,2);
    INSERT INTO t1 VALUES(3,4);
    INSERT INTO t1 VALUES(5,6);
    INSERT INTO t1 VALUES(7,8);
    CREATE TABLE t2(x,y);
    INSERT INTO t2 VALUES(1,1);
    INSERT INTO t2 VALUES(3,9);
    INSERT INTO t2 VALUES(5,25);
    INSERT INTO t2 VALUES(7,49);
    COMMIT;
  }
  execsql {
    SELECT a, (SELECT y FROM t2 WHERE x=a) FROM t1 WHERE b<8
  }
} {1 1 3 9 5 25}
do_test subquery-1.2 {
  execsql {
    UPDATE t1 SET b=b+(SELECT y FROM t2 WHERE x=a);
    SELECT * FROM t1;
  }
} {1 3 3 13 5 31 7 57}

do_test subquery-1.3 {
  execsql {
    SELECT b FROM t1 WHERE EXISTS(SELECT * FROM t2 WHERE y=a)
  }
} {3}
do_test subquery-1.4 {
  execsql {
    SELECT b FROM t1 WHERE NOT EXISTS(SELECT * FROM t2 WHERE y=a)
  }
} {13 31 57}

# Simple tests to make sure correlated subqueries in WHERE clauses
# are used by the query optimizer correctly.
do_test subquery-1.5 {
  execsql {
    SELECT a, x FROM t1, t2 WHERE t1.a = (SELECT x);
  }
} {1 1 3 3 5 5 7 7}
do_test subquery-1.6 {
  execsql {
    CREATE INDEX i1 ON t1(a);
    SELECT a, x FROM t1, t2 WHERE t1.a = (SELECT x);
  }
} {1 1 3 3 5 5 7 7}
do_test subquery-1.7 {
  execsql {
    SELECT a, x FROM t2, t1 WHERE t1.a = (SELECT x);
  }
} {1 1 3 3 5 5 7 7}

# Try an aggregate in both the subquery and the parent query.
do_test subquery-1.8 {
  execsql {
    SELECT count(*) FROM t1 WHERE a > (SELECT count(*) FROM t2);
  }
} {2}

# Test a correlated subquery disables the "only open the index" optimization.
do_test subquery-1.9.1 {
  execsql {
    SELECT (y*2)>b FROM t1, t2 WHERE a=x;
  }
} {0 1 1 1}
do_test subquery-1.9.2 {
  execsql {
    SELECT a FROM t1 WHERE (SELECT (y*2)>b FROM t2 WHERE a=x); 
  }
} {3 5 7}

# Test that the flattening optimization works with subquery expressions.
do_test subquery-1.10.1 {
  execsql {
    SELECT (SELECT a), b FROM t1;
  }
} {1 3 3 13 5 31 7 57}
do_test subquery-1.10.2 {
  execsql {
    SELECT * FROM (SELECT (SELECT a), b FROM t1);
  }
} {1 3 3 13 5 31 7 57}
do_test subquery-1.10.3 {
  execsql {
    SELECT * FROM (SELECT (SELECT sum(a) FROM t1));
  }
} {16.0}
do_test subquery-1.10.4 {
  execsql {
    CREATE TABLE t5 (val int, period text PRIMARY KEY);
    INSERT INTO t5 VALUES(5, '2001-3');
    INSERT INTO t5 VALUES(10, '2001-4');
    INSERT INTO t5 VALUES(15, '2002-1');
    INSERT INTO t5 VALUES(5, '2002-2');
    INSERT INTO t5 VALUES(10, '2002-3');
    INSERT INTO t5 VALUES(15, '2002-4');
    INSERT INTO t5 VALUES(10, '2003-1');
    INSERT INTO t5 VALUES(5, '2003-2');
    INSERT INTO t5 VALUES(25, '2003-3');
    INSERT INTO t5 VALUES(5, '2003-4');

    SELECT "a.period", vsum
    FROM (SELECT 
      a.period,
      (select sum(val) from t5 where period between a.period and '2002-4') vsum
      FROM t5 a where a.period between '2002-1' and '2002-4')
    WHERE vsum < 45 ;
  }
} {2002-2 30.0 2002-3 25.0 2002-4 15.0}
do_test subquery-1.10.5 {
  execsql {
    DROP TABLE t5;
  }
} {}



#------------------------------------------------------------------
# The following test cases - subquery-2.* - are not logically
# organized. They're here largely because they were failing during
# one stage of development of sub-queries.
#
do_test subquery-2.1 {
  execsql {
    SELECT (SELECT 10);
  }
} {10}
do_test subquery-2.2.1 {
  execsql {
    CREATE TABLE t3(a PRIMARY KEY, b);
    INSERT INTO t3 VALUES(1, 2);
    INSERT INTO t3 VALUES(3, 1);
  }
} {}
do_test subquery-2.2.2 {
  execsql {
    SELECT * FROM t3 WHERE a IN (SELECT b FROM t3);
  }
} {1 2}
do_test subquery-2.2.3 {
  execsql {
    DROP TABLE t3;
  }
} {}
do_test subquery-2.3.1 {
  execsql {
    CREATE TABLE t3(a TEXT);
    INSERT INTO t3 VALUES('10');
  }
} {}
do_test subquery-2.3.2 {
  execsql {
    SELECT a IN (10.0, 20) FROM t3;
  }
} {0}
do_test subquery-2.3.3 {
  execsql {
    DROP TABLE t3;
  }
} {}
do_test subquery-2.4.1 {
  execsql {
    CREATE TABLE t3(a TEXT);
    INSERT INTO t3 VALUES('XX');
  }
} {}
do_test subquery-2.4.2 {
  execsql {
    SELECT count(*) FROM t3 WHERE a IN (SELECT 'XX')
  }
} {1}
do_test subquery-2.4.3 {
  execsql {
    DROP TABLE t3;
  }
} {}
do_test subquery-2.5.1 {
  execsql {
    CREATE TABLE t3(a INTEGER);
    INSERT INTO t3 VALUES(10);

    CREATE TABLE t4(x TEXT);
    INSERT INTO t4 VALUES('10.0');
  }
} {}
do_test subquery-2.5.2 {
  execsql {
    SELECT * FROM t4 WHERE x IN (SELECT a FROM t3);
  }
} {10.0}
do_test subquery-2.5.3 {
  execsql {
    CREATE INDEX t4i ON t4(x);
    SELECT * FROM t4 WHERE x IN (SELECT a FROM t3);
  }
} {10.0}
do_test subquery-2.5.4 {
  execsql {
    DROP TABLE t3;
    DROP TABLE t4;
  }
} {}

#------------------------------------------------------------------
# The following test cases - subquery-3.* - test tickets that
# were raised during development of correlated subqueries.
#

# Ticket 1083
ifcapable view {
  do_test subquery-3.1 {
    catchsql { DROP TABLE t1; }
    catchsql { DROP TABLE t2; }
    execsql {
      CREATE TABLE t1(a,b);
      INSERT INTO t1 VALUES(1,2);
      CREATE VIEW v1 AS SELECT b FROM t1 WHERE a>0;
      CREATE TABLE t2(p,q);
      INSERT INTO t2 VALUES(2,9);
      SELECT * FROM v1 WHERE EXISTS(SELECT * FROM t2 WHERE p=v1.b);
    }
  } {2}
}

# Ticket 1084
do_test subquery-3.2 {
  catchsql {
    CREATE TABLE t1(a,b);
    INSERT INTO t1 VALUES(1,2);
  }
  execsql {
    SELECT (SELECT t1.a) FROM t1;
  }
} {1}

# Test Cases subquery-3.3.* test correlated subqueries where the
# parent query is an aggregate query. Ticket #1105 is an example
# of such a query.
#
do_test subquery-3.3.1 {
  execsql {
    SELECT a, (SELECT b) FROM t1 GROUP BY a;
  }
} {1 2}
do_test subquery-3.3.2 {
  catchsql {DROP TABLE t2}
  execsql {
    CREATE TABLE t2(c, d);
    INSERT INTO t2 VALUES(1, 'one');
    INSERT INTO t2 VALUES(2, 'two');
    SELECT a, (SELECT d FROM t2 WHERE a=c) FROM t1 GROUP BY a;
  }
} {1 one}
do_test subquery-3.3.3 {
  execsql {
    INSERT INTO t1 VALUES(2, 4);
    SELECT max(a), (SELECT d FROM t2 WHERE a=c) FROM t1;
  }
} {2 two}
do_test subquery-3.3.4 {
  execsql {
    SELECT a, (SELECT (SELECT d FROM t2 WHERE a=c)) FROM t1 GROUP BY a;
  }
} {1 one 2 two}
do_test subquery-3.3.5 {
  execsql {
    SELECT a, (SELECT count(*) FROM t2 WHERE a=c) FROM t1;
  }
} {1 1 2 1}

#------------------------------------------------------------------
# These tests - subquery-4.* - use the TCL statement cache to try 
# and expose bugs to do with re-using statements that have been 
# passed to sqlite3_reset().
#
# One problem was that VDBE memory cells were not being initialised
# to NULL on the second and subsequent executions.
#
do_test subquery-4.1.1 {
  execsql {
    SELECT (SELECT a FROM t1);
  }
} {1}
do_test subquery-4.2 {
  execsql {
    DELETE FROM t1;
    SELECT (SELECT a FROM t1);
  }
} {{}}
do_test subquery-4.2.1 {
  execsql {
    CREATE TABLE t3(a PRIMARY KEY);
    INSERT INTO t3 VALUES(10);
  }
  execsql {INSERT INTO t3 VALUES((SELECT max(a) FROM t3)+1)}
} {}
do_test subquery-4.2.2 {
  execsql {INSERT INTO t3 VALUES((SELECT max(a) FROM t3)+1)}
} {}



finish_test


